genre,name,critic_reviews,audience_reviews
Action,silent_night_2023,"Silent Night is old-school John Woo with a new-school twist. It uses the lack of dialogue to its advantage, weaving a narrative free of exposition and fully reliant on the skills of Kinnaman and Woo to carry the story forward.  The film tries to push its “no dialogue” gimmick as a selling point, but in reality, it only hurts the film by making it an awkward experience for both the actors on the screen and the audience watching it. A cacophony of bad. Silent Night works very well in terms of action. [Full review in Spanish] All is not calm, all is not bright in John Woo's propulsive return to Hollywood with this violent, emotionally tacit slice of vigilante vitriol.  Silent Night can’t touch Woo’s all-timers, but it’s still an entertaining, action heavy ride with some surprising heart. There are a couple of Woo's trademark visual flourishes, but by the final act, you'll be yearning for a good old-fashioned expletive to enliven the drab proceedings. John Woo’s first American film in 20 years is not the filmmaker at his peak — but it has its moments, with energetically filmed action enough to distract from a melodramatic tone and sometimes silly concept. For my money, Woo has never been traditionally scripted. Silent Night is not an outlier for Woo, in other words--it's a meticulously-engineered vehicle for action. Silent Night won’t leave you speechless this holiday season. 
 Woo could create action-filled cinema with some emotional resonance, but Silent Night can’t keep up. The final battle and stairway shootout save the film, but don’t expect the wall-to-wall action seen in John Wick. 

 The film is scuppered by its own gimmick. The gimmick of having no dialogue in a movie quickly becomes boring in the idiotic action flick Silent Night, which has too many repetitive scenes of the vigilante protagonist preparing for his revenge mission. Woo’s ability to choreograph mayhem in beautifully bloody fashion, meanwhile, can still be a thrill. In an era that everything has to be socially relevant and politically-correct, “Silent Night” offers an audiovisual extravaganza filled with the most entertaining fanservice, in a blast from the past that actually feels reinvigorating.

 ...all-too-quickly collapses under the weight of its intriguing yet progressively untenable gimmick... This comeback movie has a lot of what Woo is famous for, such as operatic gunfights, but it also has something new: there is almost no dialogue over the 104-minute run-time. Those wanting a John Woo return will have to wait. Unfortunately, Silent Night is too bland, boring, and poorly made to bring him back to the mainstream. Strikes the perfect balance between intense action sequences and equally commanding emotional moments to create a stunning film that fires on all cylinders. This film reunites us with an old teacher who has become a competent imitator of his students. [Full review in Spanish]","Direção excelente, mas roteiro fraquissimo The no dialog gimmick is just that…a conceit that quickly falls flat. I mean, really, the wife has to be mute as well? You can have the actors grimace all you want, but it doesn’t make for a watchable film. This movie is a direct copy of the Kevin Bacon movie “Death Sentence.” Gang kills dude’s son, dude mentally breaks, swears revenge, goes against entire gang somehow becoming Superman fighting a series of progressively harder evil characters until he gets to the “Final Boss.” Too unrealistic to be good. A clever idea that could have been better executed.. a John Wick/Nobody style movie where the main character never says a word. I enjoyed it but its not for everyone. You have to be too stupid to like this film I loved the idea of the movie, but it just didn't reach the potential that it had. Right of the back the main character has a run in with the bad guys getting blasted in this back and neck. By a miracle he is still alive but now a mute.  He then seeks revenge and trains to kill them all of X-mas.

One of my biggest pet peeves was him buying a car and lining it with bullet proof vest. Yet for some reason whenever his car was shot at all of the bullets bounced right off of the body and his glass windows for some odd reason. Everything was way over the top and just felt really bad and not thought out. There was another scene where a biker was chasing him down in his car. They go into an ally way and he pins the biker against his car and a building yet somehow the biker is fine and holding onto his sideview mirror. He then drivers the biker into a pole killing the biker that could of easily let go before then. I ended up turning the movie off with 28 minutes left. Think this is the first movie I've ever started and did not finish. i am flipping channels and this is one of the few movies i haven't seen but each time i try to see if it's worth watching......it's WAY tooooo s l o w and way tooooo silent! This was a cool movie. Reminiscent of the old silent movies of the 20s and 30s. It's gritty and raw. Some may not like it bc most ppl are socially ignorant and unable to read other ppl or take so much as a social cue. I thought this was pretty awesome. You really feel the emotion and the psychological aspects of what the characters are experiencing. A very bad idea! John Woo's Silent Night swings for the fences and misses completely. This was a half baked concept that might have seemed cool on paper but on film it falls completely on it's face. Silent Night does have some decent action here and there but even that is far from saving this bad film. It's a shame because I'm a really big John Woo fan and he is always coming up with great action flicks. This one just happens to be one of his minimal few ones. This action film is pretty much a silent film as it contains no dialogue at all from any of it's characters. Our main character seeks revenge on bad guys who had something to do with his son's death. While trying to save his son our hero damages his vocal chords so he can no longer speak. This sets up the premise of the film and let me tell you it gets very old after a while. Silent Night gets a low 1 1/2 stars out of 5. One word... Ridiculous! Completely unrealistic, no creativity, no dialogue, bad acting, pointless. If you waste your time on this, you were warned. Just wow! What an experience! A modern day silent film. The lack of dialogue heightened the perception of all the sounds to the max. All of the punches, kicks, gun shots, grunts and breaths are clearly heard and felt. 

The fight scenes were choreographed to perfection. Normally in action movies the protagonist cartoonishly outmatches the bad guys. In this film you see a much more realistic depiction of fights where the protagonist often gets hurt badly, but comes out on top because he really is that guy. 

Another excellent element of the film is the showcasing of how an average man transforms into a killing machine. Instead of simply entering the movie prepackaged with fighting/shooting skills, we get to see the training and progress it takes to become who he is. 

This feels more of like going on a ride at an amusement park than a movie, in the best way. This is an action movie that would be played in an art film festival. Opening scene already shows how bad this is.. first 4 minutes. Guy runs straight down an alley fleeing from a car. Gangsters in car can’t shoot him while he’s running in a straight line 15 ft away, then car runs into a forklift at the end of the alley that is completely visible, killing several in the vehicle of course. LOL WUT. It was just okay. Some moments were so unrealistic that I almost turned it off. Excellent action flick.  Maybe not as good as John Wick 4.  But more like John Wick 2 or 3.  Loved it. Took way too long to get to the action. When it finally did, it was enjoyable. Some cool action scenes but fails to leave a lasting impression or ever truly make you feel invested in any of the characters. The lack of dialogue is an interesting choice but falls flat on its face in my opinion. What a ride, I loved it! Gritty and stylish. Brought back the good times of John Woo. I want to see more of Joel Kinnaman as an action hero. Movie was awful.  Basically no dialogue and no connections to any of the characters in the movie outside the Father who lost his son.  Nothing was believable (from surviving getting shot in the throat), to who knows what the wife is up to or going through. Kid Cudi has no story to him aside from the ending.  Just a horrible movie. John Woo? Poo poo. They obviously saved money on script writers and no need for them in this movie as there was not one spoken word. They were trying to be clever and run the whole movie with no speech. There were parts in the movie at the beginning with his wife and in the end with the cop where they should have at least spoken. To not do so made the film ridiculous and could have been so much better. John Woo? Poo poo. They obviously saved money on script writers and no need for them in this movie as there was not one spoken word. They were trying to be clever and run the whole movie with no speech. There were parts in the movie at the beginning with his wife and in the end with the cop where they should have at least spoken. To not do so made the film ridiculous and could have been so much better."
Action,the_marvels,"This narrative is pure comic book ridiculousness done correctly. The Marvels has its fair share of action and dramatic moments, but more than anything else this film strives to entertain the viewer. The Marvels could have been so much more, but with evident overproduction, nonsensical dialogue, bad editing, and a keen lack of vision to say anything substantive, it is yet another loss for Marvel Studios.  ... go along with all the talk about mysterious alien bangles, wormholes on the fritz, jump point surges, malfunctioning light-based powers ... Eventually, we land on a story about family, female friendship, and Flerkens ... It does go higher, and further, but puts a little too much stock in faster. Unlike the more recent superhero movies that are lengthy and burdened by questions about origin and identity, The Marvels is a breezy entertainer that does not doesn’t take itself too seriously... I thought the superhero fatigue was real for me, so much so that I completely opted out of Blue Beetle. But Disney does what it does, and since it insists on continuing its now sprawling universe, I couldn't help but be intrigued by The Marvels. The Marvels has its moments but can’t overcome the same old problems we’ve watched plague the MCU for years. No amount of body-switching gimmickry can save this film. If you want something a little bit on the more frivolous side for fun, give it a shot. Couldn't hurt. But it's hard to recommend to anybody who takes this stuff more seriously. Marvels” has a lot of bonkers, jump the shark moments that I loved and hated at the same time. There is a colorful, musical sequence; the Disneyfication of Captain Marvel, which really infuriated me and made me want to get a twirl to fully see the dress A superhero film so anxious to satisfy everyone, everywhere all at once, it ends up inciting dread whenever its foolish coven of superwomen are trying to act like people who like each other. The Marvels is as enjoyable as a turn in the pillory.  The cinematic superhero slide continues with this disappointing follow-up to the superior Captain Marvel. It’s a joy to watch these superwomen support and empower one another. The Marvels deserved more love than it got and is one of the more accessible, you don't *need* to have watched all/any of the other films to enjoy this science fiction romp following three super women as they team up to save the universe. The Marvels was a perfectly fine hour and forty-ish minutes, with some fun character interaction and some decent superhero action, the only issue is it just didn’t have the drive or gravitas to really pull me in. Not bad, but not great either.  This one has some truly weird sequences and the best use of “Memory” from Cats maybe ever in film history.  The weakest and least buzzed-about Marvel film in some time – and it’s a shame. There was such a big opportunity here and they blew it.  Unlike too many of its predecessors, this is a fast-moving and fun entry in the MCU. The Marvels is fine! Just fine. Don’t expect too much, and it won’t under-deliver.  Fans of MS. MARVEL (like me) should have a great time with this team-up because despite the heavier moments of Carol Danvers and Monica Rambeau reuniting after decades apart, the bigger focus is on Kamala Khan meeting her idol. ","Possibly the worst movie in MCU. Extremely lame and boring movie. Quick villain build-up, boring boss battle, and halfway through I forgot what was keeping ""Captain"" Marvel motivated. Another fail, unfortunately. The ppl who made this movie, The writers, the directors, producers. Must have given up before this was made. All the reviewers that gave this anything above a half a star must have felt so bad for it. They gave it a mercy 5 our of 5 stars. Now lying isn't fair to the movie going audience. My grandma was fooled. She was really mad Falls fowl of the current Marvel phase of mediocrity.

The writing isn't great, the gimmick of switching places seems to be very inconsistent, sometimes they change other times they don't... 
Why there is a musical number part way through escapes me... 
The villain of the piece also feels forgettable with a weird motive that could easily have been solved by other means... 
Ms Marvel was a relatively interesting series with it's effects, but it feels like she skips through his film with an ability to read the room about as well as a blind man driving a car. Millennial humor. Marvel really took a turn for the worst with this one. If you want to understand why the ""mcu"" is the way it is today, this movie is the perfect summary. It Works Great As a ""Classic"" Superhero Story Not worth my time.  Plot is a mess. Absolute 🗑️. Poor writing acting and more. Extremely lame and boring movie.  This was a STINKER!  Quick villain build-up, boring boss battle, and halfway through I forgot what was keeping ""Captain"" Marvel motivated.  Another fail, unfortunately.  Bad way to end the year. A planet, where they speak English, but can’t understand you if you aren’t singing. That’s all that needs to be said. The entire thing felt like one big gimmick. Good visuals but super predictable story and very lame villain I didn't like it at all, I wouldn't recommend it Probably the worst movie in the Marvel Cinematic Universe, I couldn't finish watching it...that's how bad it was. This is a very disappointing movie.  It features poor writing, lackluster performances, an unthreatening villain, plot holes you could drive a Kree destroyer through, cardboard characters, and a boatload of silliness that simply does not belong.

Why is there superhero fatigue and why are fans of the genre no longer going to these movies?  There are far too many like these in which ""the Marvel Way"" substitutes for any originality, heart, or creativity. The second worst marvel movie ever made, The Eternals being the worst.  

The Miss Marvel TV serves was fantastic. 

This was hot garbage

Dance routines and cats with mouth tendrils was as stupid as it gets, it deserves the lowest rating possible. I couldn't even call it as a Movie. The only reason i gave an one star is because that is the my last sympathy left on marvel. Movie was horrible. Why marvel thinks that public would like it if there has some using superpowers and some smashing scenes? They are knowing public as a some kind of moron? I have no idea why marvel made this thing.. Plz come back to the good old marvel.. A yawn fest of strung together, badly written scene from uncompeling C list Marvel charters built around one B list Character (Captain Marvel). 

I wonder if the scene in the film involving herds of cats was a metaphor for the whole film project? Pretty surprised by the high audience score. This was pretty slow paced and bad. Would've been better without the planet that sings everything but it's pretty good, with humor and action, and I don't get where all the hate is coming from!"
Action,die_hard,"Nothing lasts forever... except for this cinematic party that keeps welcoming us to one of the best action and christmas movies ever. 
[Full Review in Spanish] One of the most divisive holiday classics, the argument on whether John McTiernan's Die Hard is a Christmas movie, finds its way to the forefront every year. For myself, the truth is indisputable. Die Hard is a Christmas film - no, a Christmas classic. To say Die Hard still holds up is an understatement: charismatic protagonist and antagonist, great action set pieces, well paced and a top class finale. It’s no wonder so many other films and TV series continue to “do a Die Hard”, it’s still hard to top. Top to bottom, it is just endlessly entertaining and well-crafted with outstanding work from all involved. No matter how much action movies have continued to grow, this will always be the cinematic elder statesman that can scrap with the best of them. That’s right, I’m saying it, loudly and proudly, since John McTiernan’s 1988 action classic isn’t just set at Christmastime—it embodies the very spirit of the holiday. The gold standard for action filmmaking; what action movie tropes Die Hard doesn't follow, it reinvents or altogether originates, and all of them have yet to be bettered. Give Die Hard a fresh spin this year; it's the most joyous Christmas film of all!  I really appreciated the interpersonal relationship between him and his wife. It wasn't slow but it was taking its time. [It] may be the best action movie EVER. It's another anti-cheer holiday selection, but one that keeps on giving - rewatchable sans saturation... Sometimes-more often than not, even- a script with many hands on it becomes a case of too many cooks. With Die Hard, competing experienced creatives produced a film that works on multiple levels. Still the prototype of the modern action yarn -- its status was secured so rapidly that subsequent action romps were invariably described as ""Die Hard on a train / plane / bus / zeppelin / tricycle / what-have-you."" Die Hard is not only an excellent action film, it is an excellent film overall and its ability to stand the test of time and still hold up is admirable. A spectacularly thrilling film, possessing enough brains to match its brawn. The picture is extremely violent: bombs go off, bullets rip through flesh, heads are slammed against steel. But Die Hard is also smart, satirical-and, in an odd way, heartwarming. The director's spectacular ability to compose the plans and take advantage of the full range of the panoramic format possibilities. [Full Review in Spanish] It's a glorious scene-stealer for Alan Rickman, though it's a credit to Willis's cheeky charisma that his scene is not in fact stolen. Die Hard is a great example of the Hollywood studio system getting moviemaking right - the film is a perfect storm of story and talent coming together. Die Hard still feels as fresh and thrilling as the first time it screened. From the superb pacing through to the sarcastically sinister villainy of Alan Rickman, this remains a crucial template for the modern action film.","Die Hard is an action packed thrill ride from start to finish 
The cast is great 
I enjoyed the characters 
This is the best Die Hard movie out of the entire franchise Filme: Duro de Matar #durodematar #diehard				Assistido: 3-7-24
Elenco: @brucewillisbw #brucewillis @sibbettjane @devoreauxsefaswhite Paul Gleason, William Atherton, Reginald, @allanrickmanofficiall @alan_rickman_
Modelo: #ação #action #policial 
Duração: 2h 11m	Ano: 1988
Minha opinião: Este filme lança Bruce Willis ao estrelato de Hollywood. Mas ele não foi a 1ª opção. Tiveram antes Harrison Ford, Mel Gibson, Richard Gere e o 10º foi Willis. Quem imaginária outro MacClane, não sendo Willis. Temos o 1º Duro de Matar (1988), 2º Duro de Matar 2 (1990), A Vingança (1995), Duro de Matar 4.0 (2007), Um Bom Dia para Morrer (2013). O filme se passa no dia da véspera de Natal no prédio Nakatomi, onde sua esposa ou quase esposa Holly (Bedelia) trabalha na corporação. E por um engano vão buscar John no aeroporto para participar da festa dos Nakatomi. E o prédio é invadido por ladrões fortemente armados para roubar o cofre do prédio. O líder é Hans (Rickman) e eles faze reféns todos os que estão no prédio menos John. E para salvar todos MacClane. Ele busca ajuda, mas só caras que ao invés de ajudar, atrapalham a não ser Sgt. Ai. E a cada passo John eliminando os ladrões e frustrando seu plano. A coisa pega fogo e eles mandam ver com bazucas. Até o moneto que eles descobrem seu verdadeiro nome. E colocam Holly como refém. Então John tem que fazer de tudo para sava-la. E com muitas explosões e tiros, faz a marca de Duro de Matar e John MacClane. É claro que temos um final feliz. Este filme é mais light entre ação e não ação, tendo muito diálogo. Como disse aqui foi registrado o DNA do estilo de filme.
Roteiro e enredo interessante por passar em um edifício e não sendo o filme de chamas.
Vale apena assistir? Sim 
Nota: 8 por ser o 1º da série. The number one absolute best movie ever made the greatest masterpiece ever Bruce Willis gives out an exciting and action-packed performance in DIE HARD, a movie that will surely keep you glued to the screen every single minute. What can I say? This film is an absolute action classic. I saw it in the theater when it came out in '88.

The cinematography is brilliant and the storyline is great. Alan Rickman is wonderful and of course, Bruce Willis is entertaining as ever. Few action movies suck you into their world like Die Hard. I recomment it 100%. My all-time favorite film that I can watch over and over without getting bored. Definitely worth a watch, one of the better Christmas and action movies (somehow at the same time?) Whether you think it's a Christmas movie or not, this is just an awesome movie. Real classic 80s/90s action and scripting. Pretty much perfect. Best movie on earth. Awesome action sequences, a great main lead and villain, some refreshing payoff, and great christmas elements, makes die hard one of the greatest action and christmas movies of all time. Definitely worth a watch and is a Christmas film Die Hard R (nudity and killing) - Action and mystery 
Action 
Police With every new viewing, you can get a better appreciation of how expertedly crafted this movie is. An all-time classic and a true masterpiece. Definitely a classic action flick.
But seriously, couldn't they engage real German speakers to play the German baddies. ""Schieße den Fenster!"" yeah sure...
And as much as I like Alan Rickman, I'm pretty sure Jürgen Prochnow would've made the better German villain. This one makes for me the ""Great Action Trio"" as i call it alongside Rambo First Blood and Mad Max: Fury Road. Absolute perfection. die hard is the best action movie ever. yes, i mean it A little less fun every time you see it Die Hard is the greatest Christmas of all time. John McClane is just the perfect hero you love to root for, and is one of the greatest film heroes ever. He's not some huge Arnold Schwarzenegger tank that can flick people's heads off. He's just a normal cop that's trying to fix his failed relationship with his wife, so he can spend Christmas with his wife and kids. He's not sent on a mission to take out these terrorists, he's just the person with the right set of skills that finds himself in the wrong place at the wrong time, and does the right thing because even though he's not perfect, he's a good person. Bruce Willis plays him wonderfully. Hans Gruber is also one of the greatest movie villains ever, and is played brilliantly by Alan Rickman. He's just the perfect classic Christmas villain, motivated by greed. The humor in this works incredibly well, as the film is just filled with hilarious quotes from John McClane, Hans Gruber, Theo, and Argyle. The cast just has great chemistry, because it's not just individual lines that great, but also the banter the characters share. This also filled with great action set pieces and fights that are awesome to watch. The film is very iconic with moments and lines like John McClane crawling through the vents, or ""Yippee Ki-Yay (you know the rest)."" The film also sets everything up perfectly, like John McClane not having shoes and later being forced to walk on glass, or just the small moment at the end where Al shoots the terrorist that has to make everyone cheer everytime. This isn't only my favorite Christmas and action movie ever made, but this is just one of my favorite movies period. I love this movie. I didn't realise it until it started kicking off but this is my kind of movie. The plot is really good and engaging, action is great and an interesting villain."
