genre,name,critic_reviews,audience_reviews
Action,godzilla_minus_one,"Among the pantheon of Godzilla films, Minus One is one of the finest entries in the franchise’s 70-year history. It balances spectacle with substance, offering longtime fans and newcomers a reason to believe in the enduring power of the King of Monsters. The presentation of the family drama and life in Japan after WW2 are as good as the depiction of the monster. However, the melodrama went a bit overboard and the usual lagging we see in Japanese films are still here. Good, but not as good as Shin Godzilla In Japan, the monster gives food for thought: it offers pretexts to illuminate dark passages of history, to explore the complexities that exist in some human beings, to denounce and expose guilt. [Full review in Spanish] ""In the US, we see a lot of advanced technology, mumbo-jumbo, and things that aren't exactly grounded in reality to help defeat an undefeatable monster, but that's why this period piece is so cool. We're really just using what we have. Godzilla Minus One proves once again that big tent-pole filmmaking is not Hollywood’s playground. Spectacular effects work stands alongside a beautiful story of human resilience in the wake of war. A strong cast of characters keeps us grounded amid the scenes of impressive yet restrained kaiju destruction. Almost all the men are veterans who’ve seen the horrors behind the old lie, Dulce et decorum est pro patria mori (“It’s sweet and fitting to die for one’s country”). . . . “Not having been to war is something to be proud of[.]” I love this movie and call it a hidden-gem of a film.   If you like film, you should watch it. If you do not enjoy it, I’m not sure there is much anybody can do for you. Good movie, highly enjoyable. [Full review in Spanish] It propels the franchise to new heights and reaffirms Godzilla as the undisputed king of the monsters. [Full review in Spanish] Godzilla Minus One is worth watching. [Full review in Spanish] Perhaps Godzilla Minus One has too many melodramatic moments. But Godzilla emerges from the depths of the sea and creates wonderment. [Full review in Spanish] This love letter to ordinary Japanese citizens who pull together to get the country out of hard times succeeds in delivering genuine emotion along with monster action. Despite the film’s charming background and ostensible small size, Minus One is tapping into the same thrills of blockbuster filmmaking with the support of hard-earned pathos. This is a legitimately great adventure film — not just a great Godzilla film — with moments of overwhelming despair and joy... The best Godzilla movie I've seen so far! Kudos to Yamazaki & team for crafting a compelling human story that elicits genuine empathy, while delivering a gargantuan Oscar-worthy spectacle. ..far more involving and emotional than it might be expected to be. With striking special effects, a fearsome monster, much ingenuity and a strong political viewpoint, this really is quite a reboot, and certainly puts the goofy Hollywood version to shame… It has the moments of destruction and violence that one should expect from such a film. But it also contains a story that says a lot about PTSD, the use of soldiers in war, the future we leave to the young, and the value of life. Full review in Spanish. Yamazaki’s screenplay has subtly framed Shikishima as a stand-in for the nation at large, sloughing off macho Imperial dogma from underneath a suffocating shroud of survivor’s guilt. ","This is the best iteration I’ve seen regarding Godzilla. Godzilla looked terrifying and really commanded every scene he was in. The story surrounding him was very well thought out and the characters had great development and depth. They could have made a completely different story (not about Godzilla) and it still would have been good in my opinion. Also I thought subtitles might ruin the experience but it actually made it better and added to the authenticity. I highly suggest watching it on the big screen. It is insane to think this movie was made by a small team with such a high quality, this movie did not came to my Theaters but if it were i would definitely came to a 3rd time As a big Godzilla fan, this movie was an awe-inspiring masterpiece, it was so good. The action was incredible in the film and the story was so emotional and great to follow along with. In my opinion, this is the best Godzilla film, period This movie was released on Godzillas birthday anniversary and man this vfx was the true game of it Went in with way too high of expectations. It's a fine film, but the hype is way overstated. Teetering between 3 and 3.5 but sticking with 3 because overall let down given the way its been acclaimed. The BEST Godzilla!!! This film might just be the most faithful interpretation of the Daikaijū since 1998's Matthew Broderick entry. But it goes far beyond mere homage. This Godzilla is a love letter to fans, delivered with a brutal honesty that's refreshing in today's filmmaking landscape.

True to his status as a product of nuclear weaponry this version of Godzilla is a walking nuclear nightmare, leaving a path of utter devastation in its wake with intentional mass destruction, contaminating entire landscapes with radiation poisoning just by walking through along with the tragic loss of countless lives, both human and marine, to unleashing atomic breath just like when a nuclear bomb is detonated.

The film seamlessly blends personal struggles with the classic monster movie spectacle, creating a powerful and cohesive experience.

Set in a post-war Japan still grappling with the aftermath of conflict, the film benefits from remarkably honest portrayals by its cast. We follow a traditional, yet unconventional, Japanese family struggling with the emotional fallout of war. Denial, regret, and a simmering thirst for vengeance simmer beneath the surface, emotions relatable to any audience and masterfully amplified by the monstrous threat.

Sum up -Breathtaking, devastating, but above all else, honest. Silliness with an undertone of serious messsging. Not a movie that resllg lives within any of its own rules or logic. If Studio Ghibili's slice of life vibe could have a baby with a monster movie this would be its surprisingly beautiful offspring. 

The story hooked me from beginning to end, unlike other Godzilla movies where the scenes between the monster mayhem feel more like filler time to save on the CGI effects budget, I found myself genuinely invested in the characters. 

I found myself rooting for our protagonist and his unlikely family, the character growth, the dialogue, and the ease in which the director balanced Kaiju destruction and story telling which is rare in the genre of modern monster movies.

Its art and sound design gave it a modern classic feel. Combining styles and elements from the first time Godzilla appeared on screen but with modern polish. 

If I could critic this film I would have to mention that the acting was over the top at times. It had that feeling that live-action anime adaptations have when they try to translate the character mannerisms from animation to live-action. Though with the style and direction this film takes it makes sense as an artistic choice to have it be over the top, adding to the modern classic feel Godzilla Minus One focuses so strongly on. 

This outcome came mainly from the pacing. Godzilla Minus One took its time to establish its characters, their stories, and their conflicts and plot which made the ending so much more satisfying than any American version of the Godzilla franchise and most film now a days. Films tend to rush through their stories especially with any kind of action/superhero/monster movie. They tend to have flimsy plots with lose connections and ""yeah yeah yeah we'll get to that later"" mentalities. Which is why Godzilla Minus One hits the spot so well. My only wish is that I could have seen this in theaters. This film is a monsterpiece. And possibly my second favorite film of 2023. The best Godzilla movie I've seen in theaters! I saw Godzilla 2000 when that released, but that was nothing like this one. This was amazing and can't wait to own this when it's released.... Godzilla Minus One is the start of a new generation of movie making. The Visual Effects and Animation team did a great job giving life to Godzilla. The story and emotion is also the key on this movie. wow! so good. not what we expected at all. highly recommend. I love this movie and uh Takashi Yamazaki and the cast and crew did a good job while on a 15 million dollar budget and umm i can't recommend a movie enough since it's a really really good movie. The mix of drama, action, horror and a little tiny itty bitty sprinkle of romance that is mixed in this movie is why it's my most favorite movie of all time... also i love Godzilla so yeah. - Dogzilla best movie ever made, hands down. As a long time admirer of Godzilla movies and having watched most of the new franchise and the keystone films from the older Japanese era (although it was a lifetime ago).  I eagerly awaited the opportunity to see the latest instalment, and I must say that my expectations met and at times, more than exceeded.

Instantly you feel that the film's production values are reminiscent of the past, originals, and the cinematography is picture perfect, with every scene crafted to be as realistic as possible despite the period setting. Each backdrop created with historic accuracy of old Japanese building and infrastructure in the city, and the bombed cities with dilapidated shacks post attacks.  

The blending of emotions, action, and thrill is done extremely well concocting the ideal entertainment cocktail. The 2-hour run time seemed to fly by.

Godzilla is suitably elemental and monstrous, and each of the human characters are thoughtfully portrayed and sympathetic, no easy feat since the film is set in a WWII Japanese era. The only thing that makes me chuckle throughout the film are the ridiculous arms of Godzilla, bringing back flashbacks of the t-rex books I have read to to my toddler.  Possibly amongst the radioactivity Godzilla has been hitting the gym pretty hard. 

What i thought was different and unique about this version is that it added depth to the human element, complete with fractured cities and families. Into this mess wades a monster from the sea that starts stomping streets, crashing into buildings, and tossing railroad cars (with strange arms)  etc. all done without the over use of CGI, often making the film feel almost from an older era.It blends practical effects seamlessly with the limited CGI the film does have, creating a truly believable world under siege. From the colossal Godzilla to the human devastation, every detail is meticulously crafted.

The character development for me is the key winning factor here. The screenwriter sets up a prologue of events that lets the audience connect with the characters, helping us understand their motivations and actions. 
 The camerawork is on point as well often putting you right in the shoes of characters grappling with paralysing fear and running in order to survive. 

Powerful performances make you feel every emotion alongside the characters. Ryunosuke Kamiki takes center stage, portraying a complex hero wrestling with trauma, as he feels an urge for revenge, alongside a sense of hopelessness. His connection with other characters adds layer of humanity, making their struggles just captivating.

This film is more than just a Kaiju movie; it explores themes of patriotism, endurance, short arm syndrome and the will to move forward. But aside from all that it's a pretty darn awesome, oversized lizard creating havoc film. 9/10 I love it this movie Best Godzilla Movie of all time! The human characters are for once interesting to watch, Godzilla looks awesome and is made really well a mixture of the Heisei version and the 1954 and Legendary Godzilla. 
Best Movie I have seen of 2023... If you’re only going to watch one Godzilla movie in your life, I might recommend that it be Godzilla Minus One. I’ve seen a handful of them and, to be honest, I haven’t been very impressed. However, this version has a compelling plot surrounding the humans. The actors aren’t acting like they’re in a cheesy monster flick, they’re giving highly dramatic performances. It also helped me realize why people are afraid of Godzilla. He’s menacing and terrifying and when he attacks, it all seems so hopeless. They could have subtracted about 20 minutes or so from Godzilla Minus One, but I enjoyed watching it. Why Minus One?"
Action,napoleon_2023,"A paint-by-numbers biopic that seems woefully indecisive in its opinion of the man whose story it’s portraying. I’m invigorated and inspired by the fact that a movie like Napoleon can exist in the modern era ... the blend of war epic and farcical romance, acted and directed masterfully, is the kind of full spectacle that we go to the movies for. I mean, the movie was perplexing at points, but this reads like someone having an out-of-body experience... Each act contains a spectacle-filled battle scene, beautifully choreographed, lit, and shot. Scott (“Gladiator”) knows what he’s doing with action scenes. No complaints here. The rest of the narrative trips him up, however.  Napoleon is a challenging epic. Napoleon is the confluence of two centuries of documentation and innuendo, and how, maybe, a tyrant who led millions to their death doesn’t deserve better than to be portrayed as a weird little guy horny for his mean wife. Scott’s depiction of Napoleonic warfare is equal parts beautiful and brutal. “Napoleon” is a gorgeous movie, but you won’t see it when you fall asleep between battles. The combination of pitch perfect visuals with comedic, outlandish dialogue does not ever gel, and Scott lacks the necessary pacing to let everyone enjoy the joke.  A battle-laden pilgrimage through the historical highlights of France's most prolific Emperor cuts considerable corners in conveying his military machinations. Questionable casting, jarring tonal shifts and a repetitive dependence on the battlefield... On its way to theatrical release, 'Napoleon' has lost an hour and a half of footage, affecting a dramatic progression that feels too disjointed, cold, and at times, lacking in soul.  This lavish production never feels like an incredible story, nor does it ever feel particularly intimate. Truthfully, Napoleon rarely feels like anything; perfunctory emotions that are adequately portrayed by talented actors adrift in a sea of tedium. This two and a half hour-plus battle-heavy film shies away from nothing and really does give you kind of what you expect- epic action in a way that we know and love Ridley Scott for and a bonkers performance that we know and love Joaquin Phoenix for. Although I was never bored, this two-and-a-half-hour film made me feel like I was sitting through a three-and-a-half-hour film.
 Napoleon is a shallow collection of impressions, “psychological” insight of the dime-store variety and brief battle scenes, which are not even presented so as to explain Napoleon’s military prowess. Who was it that said history was just one damn thing after another? This is what Sir Ridley Scott's epic [...] feels like when not focused on the electrifying performance of Joaquin Phoenix.  Ridley Scott's ""Napoleon"" is more of a romantic epic than an exploration of the personality of a despot. [Full Review in Spanish] Tonally, it’s flat and unengaging, leaving us uncertain whether we should be taking it seriously or reading Phoenix’s simpering interpretation of Napoleon as satire. Scott makes no apologies for Napoleon and never treats him as some hero for France. Napoleon succeeds at presenting the insecurities of this man’s life for audiences who may be unaware of French history. I just wish it was narrower in its scope. Joaquin Phoenix’s blustering performance conquers as Napoleon. This is such a misfire. It is 2 hours and 38 minutes of my life I would like back. At the end of the movie, I knew nothing more about Napoleon than I did when it started.","Didn't do Bonaparte any justice, the thick American accents take me right out of the moment. Although, there are many historical inaccuracies that part is relatively easy to get over. The movie feels like a bunch of trailers strung together, into a jumbled mess and embarrassment to Napoleon's story. There is nearly zero indication in the movie that Napoleon is a great or even decent general. All in all a mumbled together movie which likely needed its own show, but Ridley Scott would mess that up so. I enjoy these types of movies but this one wasn’t my favorite. I felt like it had some good parts, especially the action scenes. They did a great job building the scene and tensions. The problem was that it felt a little too long and they probably could have cut some scenes short to speed up the pacing. The scenes between the battles dragged on a little bit and I got bored from it. yawn, yawn and yawn. it was too long and read about it in a history book. you'll find it more interesting. Watch anything on history march instead http://youtu.be/55dNKFvKuQs?si=gaUQoJRE5Er1q8XR Snooze Fest! Not the best performance from Phoenix. Editing seems to be a lost art in Hollywood these days. The sex scenes were perverted and gratuitous. It would be easy enough to suggest what is happening in a classy way with some well timed edits, instead these cringe sex scenes just made a mockery of the relationship of Napoleon and his empress. Slept throughout half of it. Terrible acting, lots of violence and little to learn or appreciate about the film. First of all, like most movies he stars in, Joachim Phoenix owns this movie.

The battle scenes are immense as you would expect, and despite what many of the 'real' critics say, there are plenty of these action sequences to keep you engaged in between the non-action scenes.

If you can forgive the lack of French accents from, you know, the guys playing the French parts, and you like a good historic war drama, you should enjoy this film. A pretty decent film. If you’re going to deviate that much from undisputed historical sources, just create a fictional character. The script was horrible. In my opinion, Director mistake is a lack of dcreen time - the story of Napoleon deserve more films - at least 4, like his company in russia, described in War And Peace, was filmed as 4 movies, waterloo was the long seperate movie, but he tried hid best - Phoenix is perfectly suitable for this role looks like a movie made by a person who don’t know nothing about history One of the biggest cinematic disappointments in recent memory. Terribly written, and even more poorly acted. Perhaps the worst performance of Joaquin Phoenix’s career. Difícil de ver, errores históticos, casi parece un fan fiction de Bonaparte. My god., I couldn't stay more than 30min. So boring. So stupid. I'm French so I loves to see all English speakers too 😂😂
Thanks ridley Scott to let me waste 30min of my life 🍅 6.3/10


Joaquin Phoenix Really do be making them clap sounds 🤨 I mean since he’s short a couple inches had to go somewhere right. It’s nothing bad just nothing remarkable it feels like it should be more epic but ends up being a stale drama that focuses on its most uninteresting plot. Still there’s some pretty cool fights and great set pieces and the performances are pretty good all around. Grade B This movie was truly made only for the big screen. I enjoyed it immensely.  Joaquin pheonix is sublime as napoleon and Ridley Scott delivers his battle sequences in perfect formation. Enjoyable flick but I feel Joaquin Phoenix was miscast on this one. He seemed too sluggish and docile to be
the aggressive French Emperor that carved out a name for himself forever in the history books.
The final battle scene at Waterloo was fantastic though and worth watching just for that. Bad movie. Bonaparte was not a kid or a puppet. How can the director write : 6 millions people died because of Napoléon? 6 millions soldiers died because of kings and kingdoms around France were afraid about loosing their power.
It's juste an example : this movie is a story not History.
No need to watch this stupid movie."
