genre,name,critic_reviews,audience_reviews
Action,concrete_utopia,"As allegories go, it is a bit heavy-handed, but Um's totalising vision in terms of imagery, soundscape and performances can't be faulted.  At its most political, Concrete Utopia finds the fascist project essentially anti-life and destined for a systemic collapse. Eom's supple film shows the best and worst of human nature, often displayed by the same people Powered by Lee Byung-hun’s performance and truly outstanding production design, Concrete Utopia finds its own niche in the recent spate of social satire thrillers. Its way of surprising us shows that it's aimed more at entertainment than at exploration, and manages to be quite effective in its purpose. [Full review in Spanish] Far from being a project in love with its own worldbuilding, Concrete Utopia is far more focused on the social drama and practicality of being a survivor in a destroyed city that used to house ten million living people. If George Orwell had had a career stint as a Korean estate agent, this is the kind of story he might have turned out. Concrete Utopia stands out for its spectacular production design, which combines scenic realism with a wide array of VFX and camera movements. [Full review in Spanish]  It’s not a particularly upbeat look at one possible grim near-future, but it is an entertaining one. A survival story with excellent visual effects - a flashback with Min-sung stands out, in which we see what the boy was doing just when the cataclysm began -, solid performances, and a lot to say about human cruelty. Full review in Spanish. A very intelligent dramaturgy solidifies the mortar, finished off by the irony that transforms the pieces of a chess game... [Full review in Spanish] Concrete Utopia fulfills its disturbing purpose: to wonder what could happen to the human race when the worst instincts emerge amid the urgency to rebuild society from its foundation. [Full review in Spanish] ... More of a social drama than a catastrophe film, like those seen in the '70s. [Full review in Spanish] With a powerful narrative and a portentous design, Concrete Utopia transports us to an apocalyptic dystopia as desolate as it is recognizable... [Full review in Spanish] Without a focal idea to build toward, Concrete Utopia is more of a cinematic experiment than a film. The filmmakers certainly weigh many heavy topics with skillful immediacy.  With brilliant performances and a balanced, harrowing story to propel it, Concrete Utopia isn’t just one of the best films of the year: it may be the best disaster thriller in years. Um turns what could have been one more post-apocalyptic thriller into an intriguing challenge of a movie. Concrete Utopia holds us in its grip. Concrete Utopia remains emotionally convincing despite being ideologically hollow. Director Um is nothing if not fiercely committed to his dystopian gimmick, for better or worse, and his actors follow suit.  A natural disaster of such magnitude might never happen, but a societal one as depicted here increasingly seems too close for any comfort. Concrete Utopia is hardly the first disaster movie in which panic trumps morality. But this vision of a “utopia” smashed to pieces is more disturbing and believable than most.","Really good show!!!
I loved it so much, it was such an amazing experience with my favourite artists. Entertaining enough but a bit of a disappointment given the stellar reviews, the story/action/etc wasn't as compelling as you'd hope and the social commentary wasn't as nuanced either. Was a bit reluctant about this but have to say it was very good. Great character development and dialogue. Really loved it.  Korea has put out some really good quality stuff lately which is more than I can say for Hollywood which seems to be in decline. Buena, pero con algunos espacios muy vacíos Lo que hace creíble este drama de desastres es el enfocarse en los esfuerzos de los supervivientes, que en la causa del cataclismo. Los niveles de desconfianza y paranoia no son para nada fantasiosos y por eso es digna de crédito. Buena opción para un fin de semana Una historia fuera de lo que podría ser la realidad. La película tiene puntos muertos y lentos. Finaliza con un buen cierre. No esperaba mucho, mínimo fuera con lógica y abierta con este nuevo ""mundo"". The movie asks the audience whether you would do the same if your home were the only place to survive a colossal disaster and non-residents were to flood in. It is unclear which decision is the wisest, as that question is left unanswered even after the film's 129-minute running time. One can't tell whether the unsettled feeling after the film is simply due to the genre's characteristics as a dystopian flick.
""Concrete Utopia"" doesn't simply show Koreans' fantasies about owning an apartment or the loss of humanity in extreme situations. Rather, it invites discussion about humans' problematic desires and behaviors, including: greed, discrimination, the desire for power and human-made hierarchies.
Park Seo-joon and Park Bo-young show well-balanced acting, firmly supporting Lee Byung-hun, who once again fantastically portrays a complex, multi-dimensional character as the story unfolds.
Director Um's clever opening sequence showing what apartments mean in Korean society elevates the audience's understanding of the film's tone and style, making the film's topic accessible and relatable to moviegoers anywhere. While the narrative unfolds at a measured pace, it gradually reaches a satisfying climax, maintaining a steady and well-crafted quality. The actors deliver consistent performances, and the low to mid-budget apocalyptic scenes are handled with precision. This movie shows the human nature when authority is missing in excellent resolution, and makes clear the idea that social contract is important but is still  a very fragile concept. Entertaining flick. Disaster movie? Not exactly. Post-apocalyptic film? Maybe. Human kind in extreme conditions; that's when the real persons of every one come afloat Very interesting and heart-breaking Lord-of-the-Flies type of movie that explorers to what lengths we will go to live well at the expense of others. I think it was a very well-crafted exploration of tough choices and their consequences. And perhaps a profound look at how our views of ownership separate us from others and wellbeing for all. Pessimo muito ruim ! Mostrando como o ser humano pode ser frio, quando o assunto é sobrevivencia. Com algumas reviravoltas, faz vocêse questionar se esta do lado certo da historia Saw this movie five months ago and am still thinking about how much I enjoyed it and how I wish it made the Oscar nominations. Concrete Utopia is an amazing disaster movie set in Seoul Korea. A massive earthquake has occurred and there is only one standing apartment complex in all of the city left standing. How will they live? Defend themselves? How many others survived? The production value and moreover acting is great. It's a satisfying flick! It's standard post apocalyptic fare about humanity, but it's appropriate viewing right now. ""Concrete Utopia"" is a Korean movie that left me speechless. The film tells a gripping story filled with intense action sequences and unexpected twists. The performances by the cast are outstanding, bringing the characters to life with depth and emotion. The cinematography is visually stunning, capturing the gritty atmosphere of the urban setting. This movie is a rollercoaster of emotions, keeping you on the edge of your seat from start to finish. If you're a fan of thrilling and suspenseful films, ""Concrete Utopia"" is a must-see! Fantastic film, provocative story telling.  Park Seo Joon gives a performance that is on another level, so moving and nuanced. Even the song during the credits was beautiful and touching. Once again Korean cinema shows it knows it stuff.  This is a deftly crafted and well directed movie that pulls no punches when exposing man's darker side. I suppose the biggest message to be had from this is that humanity is great when writ small; collectively, however, we stink. The cinematography is impressive also. I have seen plenty of post-apocalyptic and war films before but none has captured sheer desolation and abject devastation like this. Riveting movie! Great special effects and scenery. The three main actors engaged the audience without a lot of dialog.  Much of  the story was told  through  their emotions."
Action,indiana_jones_and_the_dial_of_destiny,"Dial of Destiny maintains an appreciative understanding of its protagonist and legacy while comfortably being its own thing in scale, stakes and excitement. For what was promised to be one last adventure, the stakes never reach full potential in Indiana Jones and the Dial of Destiny and emotions don’t run as high as needed to elevate the sentiment that this film is eagerly attempting to tap into. There’s a very distinct lack of Spielberg magic, but Indiana Jones and the Dial of Destiny is a decently entertaining “greatest hits” adventure. Replete with exoticism, Orientalism, and a nonsense science fiction plotline, Dial of Destiny proves the case for why this entire franchise belongs in a museum.  “Dial of Destiny” is just Indy being Indy and nobody does it better than Ford. ugly, prosaic and dull DIAL OF DESTINY..panders to an audience willing to be spoon-fed lines that they once recognised and moves as gracefully as its geriatric lead From a thrilling opening act, where Indy takes on a Nazi loot train, to a wild and wacky chase through Tangiers, Dial of Destiny proves the old grave robber can still deliver the goods.  Post-2016, Indy’s renown disgust over Nazis feels urgent and relevant, and the film does a subtle job of condemning the US for embracing and elevating Nazis over its now obsolete and forgotten heroes, WWII veterans and anyone who resisted the Nazis.  Far too long, but a somewhat fun time at the movies But ""better than Crystal Skull"" is a miserably low bar to clear. Dial's plot is surprisingly dumb, considering it took four screenwriters (including David Koepp and director James Mangold) to write it. I think you can find fun here. I think you can find good here. It's just not going to turn you around if you come in thinking it's a bad idea. Dial of Destiny is a fun ride, especially for moviegoers like me who just want to enjoy some nostalgia as we contemplate a retirement full of watching all those films we’ve collected over the years. There's a lot that's fun here... but the more you look at the CG, the more it looks like The Polar Express. There wasn't a world wherein this film would capture the greatness of the original trilogy but it's nice to see Indy and his compatriots sent off in fine, if unspectacular, fashion.  At the end of the day, Indiana Jones and the Dial of Destiny may not be the best installment of Indiana Jones, but it certainly fits perfectly within the saga, committing to its characters and its essence. [Full review in Spanish] A beautiful send-off for this character. He steps back into that fedora not like he’s never left it, which is the point. He meets his character where he actually is – old, alone, grieving.  And while the story is bombastic, is still better than aliens. With that in mind, I'll give the film a B-, its not perfect, but if you settle in, you can enjoy one last adventure. Despite the weirdly ambivalent headlines and mixed reviews dogging this film since its bow at Cannes, this is one of the most consistently enjoyable legacy sequels of recent years. It’s fun; it’s wacky; it works.","After much anticipation, I finally had the opportunity to watch this movie, despite purchasing it some time ago. The beginning of the film was quite impressive, featuring a de-aged Harrison Ford. However, after transitioning to 1969, the film's quality unfortunately declined significantly.

The acting in the CGI-laden film was abysmal, with Phoebe Waller-Bridge's performance standing out as the worst of all. The movie should have concluded the Indiana Jones saga with The Last Crusade, as that film provided a more satisfying ending. Unfortunately, the entire cast delivered subpar performances, detracting from the film's potential.

The film squandered its potential due to lackluster filmmaking and acting, resembling a poorly made fan film. The story was uninspired and unimaginative, resulting in a lazy and unengaging narrative.

It is incomprehensible how this film managed to receive an 88% score. Among all the Indiana films, this one stands out as the worst. Mesma receitinha de bolo dos anteriores, para rememorar os velhos tempos, nada de novo em meio as ações e a trilha sonora inesquecível, só… Gostosinho, legalzinho, bem produzido, ótimos cenas de ação, eu gosto de antiguidades, eles tentaram, válido o esforço coletivo, tem algumas boas tiradas de humor enferrujado, Harrison Ford está um adorável canastrão mal-humorado cativante, Mediano e regular... More Disney vandalization of a once-beloved franchise. If you loved the originals, this will only make you angry. Not sure who the intended audience is here. I have almost zero faith in audience scores now as there’s no way this legitimately scored 88%. No way in ….. this movie has an 88% audience score. Just ain’t no way. I just watched it for the first time this evening. July 22, 2024. I put off watching it cause it’s exactly that I thought it would be. A let down. Indy ended when they rode off into the sunset in the last crusade. I like ford and mangold as they’ve made some great film but this ain’t it. The cgi just looked so fake, even sets just looked like sets. The first 20 mins where they do young Indy I feel like I’m watching a video game cut scene the whole time, they kept old man fords voice for 40 year old fords face lol not even surprised it bombed in the theatre. I found the movie to be just okay; it didn't quite live up to the standards set by other films. The lead actor didn't bring his usual flair to the role, and the plot felt somewhat lacking. Additionally, the absence of the main character's son as the heir to the Indiana Jones legacy was disappointing, especially since the character was killed off by the writer. It almost seemed like the movie had been planned for release a few years earlier, but the writers were unsure of how to conclude the story. it was terrible... NOT indiana jones at all... 

bad... just bad.... It's great to see Ford return to the role again. While not the best of the series, the film is very entertaining, true to form, and a fitting finish. Indy kept me on the edge of my seat. The film also features lots of great callbacks to previous films and makes me wish there had been more! Le scénario est incohérent, rempli de facilités. En fait, c'est si incohérent que ça en devient drôle. Impossible de rentrer dans le film à cause de cela. Ça se regarde difficilement mais c'est tout de même sympa de retrouver Indiana Jones au cinéma. De bonne notes d'humour. It could have been a great movie, but the producers did everything possible to age Indiana Jones more than necessary and give more prominence to the character of Phoebe Waller-Bridge (Helen Shaw), who is much more unpleasant than Mutt (Shia Labeouf) was in the previous film.
It would have much been better to use another character from the Jones family or hire another actor to reprise Mutt. If South Park thought the last Indy movie raped Indiana Jones, this one is digging up his corpse and defiling it in the same way.  There is no way this is deserving of an 88% audience score.  I don't believe that for a second.  You know what's worse than review bombing that no one talks about?  Review inflating.  Where studios pay unscrupulous companies to use bots to give fake 10/10 or 5/5 reviews to make a movie seem way better than it really is, because the studio doesn't care if you like it after taking your movie ticket money. I thought the story was ok. The ending was really cool, wish they were there for a bit longer and they could have had the story mostly there. Would have made for a crazy film. But you get what you get. The parts where Indys friend dies I thought could have been filmed better. Very poor. An unfortunate misfire. Tries to recreate the magic of Raiders but basically fails due to bad editing, unconvincing CGI, and a story arc that is dull and makes no sense whatsoever. The humor is forced, and the ending is just bizarre. The one redeeming feature is the young Harrison Ford. That was kind of amazing how they did that. The popular franchise that made Indiana Jones it's name completely goes off the rails in this film.  it just isn't my favorite of Indy's franchise.  it's not bad but the first three in the indiana jones canon are my favorite movies of all time.  This one puts a sour taste on indy's popularity. Awful movie. The plot seems to be all over the place and very bad writing. What is though most annoying, is the fact that for a whole movie named Indiana Jones, Dr Jones is discredited constantly and not because it makes sense in the story, but only for the replacement character that lacks character to look good. There were many opportunities that could allow Indiana Jones to excel in some scenes based on his knowledge, experience and veteran status, and in some physical aspects to appear as the old man he is and depict the inevitable fact everyone is growing old, while the new character could be the opposite. But no, again Disney had to bring the female character who is better at everything than Indiana Jones in an Indiana Jones movie, and honestly made him obsolete. He could easily just not be in the film and nothing would change. As a long-time fan and admirer of the franchise, I was pleasantly surprised at this entry.  Great plot line, with interesting references and the story moves along nicely. Indiana Jones And The Dial Of Destiny was a great send off to Harrison Ford’s iteration of Indiana Jones. The movie was packed with action and I enjoyed the introduction of the new characters. I do think they coulda trimmed some of it, cause it seemed longer than it needed to be. I hope they give this franchise a rest and then reboot it in like 5-10 years. Definitely worth the rental. Movie kept you engaged. Storyline was good and fast paced.  Better than I expected given Ford’s age. Thoroughly enjoyed the movie and a great way to end the series. It’s a definite watch. God awful film, the opening 20 mins were alright then it decends into chaos Damn, was hoping for a good movie.... this is isn't it."
