genre,name,critic_reviews,audience_reviews
Action,the_hunger_games_the_ballad_of_songbirds_and_snakes," It may not always sing like a songbird when taken as a whole, but The Ballad of Songbirds and Snakes still packs a venomous bite at its best. ...retains the hard edge that made most of these movies register as piercing satires of our reality-television age. Ballad sanitizes its brutality for a PG-13 rating and diminishes the story’s sense of high-stakes survive-or-die suspense, and Francis Lawrence’s approach to action sequences is bland and uninspired, a reflection of the film’s generic visual aesthetic.  A surprisingly bleak yet narratively elemental mishmash of derivative dystopian tropes, the film's real subversion exists in the delightfully garish and incredibly callous supporting characters bedazzling the decadent capital of Panem.  While many critics have carped about the decision to hand an entire film over to a character everyone knows will turn evil (apparently, these critics never heard of the Star Wars prequels), the truth is that it’s surprisingly compelling. Aside from an interesting and somewhat original story,  The Ballad of Songbirds and Snakes has a wonderful cast that includes younger thespians mixed with seasoned veterans. Gives a backstory that fleshes out the franchise a little more – and quite honestly, ups the ante. It’s beautifully shot, well-acted, really engaging, and makes for an excellent reason to go to the movies.  There’s still space in this world for the lessons The Hunger Games can teach us about the way we consume media and news, but The Ballad of Songbirds & Snakes is not clear enough in its vision to be as impactful as its predecessors. An involving prequel that understands the troubling politics buckling a society of inequality and gets brutal when necessary in its depiction of the games. Despite a bit muddled third act its an engrossing prologue. The Hunger Games: The Ballad of Songbirds and Snakes will cater to tributes, but the unnecessarily long prequel can’t flesh out a one-dimensional villain with a rise and fall narrative in which to emotionally invest. Much better than expected and featuring two stand out performances and a world that I find very interesting overall.  A prequel to the four-film series that provides the origin story for the evil ruler of Panen. The ”snakes” of the title may refer to that mass of multicoloured serpents Dr. Gaul wants to unleash on the hapless tributes, but it’s just as easy to see Coryo as the snake to Lucy Grey’s songbird. [It] has a decent number of exciting, breathtaking moments, as the Games play themselves out. But they can’t sustain that intensity for the full movie, which finds itself borrowing from the past. This film questions what you will do in times of stress: Will you kill when it is the only way to survive, be loyal when it is time to be loyal, fight for love when it might mean death? It is interesting, exciting and looks so good on the big screen Set sixty-four years before the triumph of Katniss Everdeen (Jennifer Lawrence), the clever screenplay reflects the violence assimilated by the culture. [Full Review in Spanish] The Hunger Games: The Ballad of Songbirds and Snakes is more focused on delivering Easter eggs with the subtlety of a sledgehammer than developing these characters. It leaves us with nearly three hours of brand revival. The fun performances by a game cast can't make up for poor pacing and a bloated runtime that feels wholly unearned. It’s still just a slightly modernized, teen-oriented take on ""Rollerball"" or “The Running Man.” THE HUNGER GAMES: THE BALLAD OF SONGBIRDS AND SNAKES is an incredible extension of the series, both in terms of structure and theme.","I can't believe I'm saying this, but I actually wish they had split this up into two movies. I was left really confused after the 3rd part. I cannot wrap my head around any of Snow's motivations for the final 30 minutes or so. The acting (and singing!) and cinematography were fantastic, but the storytelling struggled, which is a shame for this franchise. This is the only series where I tend to strongly prefer the movies to the books. Really bad acting , boring storyline As my first hunger games movie, it is a really addicting for a thrilling battle royale experience as it is how these movies are known for. Interesting characters, interesting story and so much more to begin with. Started to get curious of this book adapted movie trilogy ever since As a prequel to the hunger games, I believe this movie served its purpose. Not overly flashy in cinematics, I believe this movie is decent enough. The actors did a good job, and the storyline followed a straightforward pattern to set up the how the hunger games came to exist. Compared to the hunger games it isn't as well-done but the movie shouldn't be judged so harshly. Didn't expect much but was pleasantly surprised, good story , good acting even good songs ""The Hunger Games presents itself as an engaging and exhilarating cinematic production that captures the attention of viewers through its captivating narrative and exceptional performances. Its grandeur is best appreciated in a theatricalg audiences into a rich and immersive fictional setting, drawinrealm. Embrace the opportunity to partake in this remarkable motion picture in theaters; it is genuinely a mandatory viewing experience, leaving an indelible impression."" I liked the other hunger game movies but this one left me ambivalent. 

Usually there is a hero but there is not one character I could care about. The book was written from Snow's perspective and casts him in a much less sympathetic light. The movie was good though, but I'm glad I read the book first. Admittedly I went in blind, having not read the book and I was pleasantly surprised! Being a big fan of the original books and movies, I had been curious about this one for a while, but hadn't got round to seeing it in cinema as I was on the fence about watching it due to the mixed reception it has received...Ended up finding it free on Neon and found I quite enjoyed it! It isn't perfect by any means as there were plenty of interesting plot points that felt slightly rushed in parts regardless of the films looong run time of 2.5ish hours, so it may have worked better as two movies, combining parts 1 and 2 and fleshing them out more in one film and part 3 also more fleshed out in another, but overall was perfectly serviceable and an effective deep dive into what made Corionalus Snow go rogue and what influenced the later games style. I'm looking forward to the next entry if it's anything like this one! A true blast from the past! Bad acting by Rachel Zegler. Not a good movie. Bad acting distracted me from following the plot. Anoying. The intelligence of the movie is sensational, the scenes of deaths are impacting, the vfx is extraordinary I'd like to rate it higher, as the first 2 acts were very much on point; Entertaining, well written, well paced, visually impressive. There's some stand out moments and although Zegler & Blyth don't set the world on fire with their on screen chemistry, there's still enough of it there to buy in and get invested in the character, enough at least to care about their fates.

Alas, much like the last part of the Original Hunger Games trilogy, they failed to stick the landing. The third act goes om too long and is slow paced so it feels like it goes on even longer. The third act throws the leads somewhat weak chemistry on the clay pigeon launcher and shouts pull. The third act seems to want to be a far more intellectual film that sits terribly with the YA content that it's based on, which balances the film terribly.

I still enjoyed it, but the third act dragged the whole film down overall. Though it is an impressively well-executed standalone prequel to The Hunger Games, the true star of the film is the music. Appalachian bluegrass is presented to an unexpectedly receptive new audience with finesse, in a way that doesn’t feel forced or separate from the plot (which admittedly starts to lag in the third act, although not unbearably). el protagonista es Snow y su historia de cómo se convierte en villano estuvo muy buen contada, ahora la saga de los ""Los Juegos del Hambre"" tiene un nuevo significado. Todavía me acuerdo mi experiencia viendo por primera vez esta saga (bastante tarde y recién durante la pandemia vale aclarar), como me habían encantado las 2 primeras y como sentí la desilusión durante ambas Sinsajo. Y es tal vez esto ultimo lo que me bajo un toque las expectativas sobre esta precuela. Sin embargo (y menos mal) esta nueva entrega me gusto demasiado, convirtiéndose en una de mis favoritas de la saga junto a la segunda. Poco mas que decir, las 2 horas y media me quedaron cortas porque la disfrute en cada momento. Si mi ultimo recuerdo de estos films va a ser esta historia estoy bien con eso. Was such a great movie very modernly shot such incredible writing from how all the hunger games have been shot in relation to the books it’s done very well and the casting is just something else a perfect movie action , sci fi, mystery ending , singing it has something for everyone I don't know what was the budget of this masterpiece, but clearly they didn't have enough money to rent more than one lens as the whole movie looks like it was shot with only wide angle lens. Odd choice. The acting is spectacular, the story-line of Coriolanus turning into Snow and the perfectly showed role of power and control that plays into our real lives now too. I Love it because i am a big hunger games fan, but also because its a great movie. Couldve been just a tiny bit longer tough. Overall it works good acting adds to this. For as long of a run time as the movie has it does not waste time and moves along it is well paced movie. The story is not as strong as the original trilogy but prequels rarely are. The story is satisfying as a whole. I read the book a year before seeing the movie and in this case the movie is better than the book."
Action,animal_2023_2,"Intellectually bankrupt, morally reprehensible and stylistically inept, Sandeep Reddy Vanga's Animal is about as irredeemable as they come. The movies best and worst qualities come from how bold and excessive everything is. The movie is totally unrestrained.  That makes the sequences and characters memorable, but it also makes the runtime totally unnecessary. Trashy, idiotic, and filled with disgusting bloody violence that's overly repetitive, Animal is excruciatingly too long at about 200 minutes. This garbage movie has no redeeming qualities. It's yet another stupid story about feuding and vengeful families. Beyond the never ending reign of bullets and butcherings, both Animal and Kapoor's vicious Ranvijay remain hollow. Animal is a complicated film with a top-tier Ranbir Kapoor, who delivers a powerhouse performance that is worth the price of admission alone. What the film lacks in substance, director Sandeep Reddy Vanga makes up for with sheer audacity and bloodshed. Ranbir Kapoor is deeply committed to his brash and ugly protagonist, but in spite of the movie’s explosive action, director Sandeep Reddy Vanga seems more preoccupied with provoking outrage than with telling a coherent story. Boring, blood-spattered film... Animal’s terrible attitude to women runs alongside a cunning use of India’s religious minorities.  Bigger, longer, bloodier: Animal is all that and more. A story which is cheerfully misogynistic, morally bankrupt and stomach-churningly violent.  All of which I could have endured if the drama and emotions had held.  It is easy to dismiss Animal as an indulgent film, one that achieves none of what it sets out to. It is. It is repulsive, revolting, and one-and-a-half- hours too long. But it is also a film that unravels as retaliation. The film washes past you, like sandpaper being rubbed against your aesthetic and moral convictions.  Watch Animal to see Anil Kapoor and Ranbir Kapoor rising above the ridiculous to give a sublime performance. Ranbir Kapoor stars in a blood-soaked drama about daddy issues that is screaming at the top of its lungs with nothing to say. Ranbir Kapoor plays one of the vilest protagonists in cinema history. ANIMAL is a pretty crazy, but somehow totally original and fresh THE GODFATHER remix, with an insane Ranbir Kapoor, a super strong Rashmika Mandanna, great music and, above all, the right amount of humor and irony. The main objective is to serve up everything and the kitchen sink. It can’t be called a cinematic feast, as it is a chore for moviegoers forced to digest heaps of plot points and tangents.  At three hours 21 minutes, Animal is relentless as a euphoric medley of feral rage and dance of the dysfunctional. The twists go on well until end credits as more blood is splattered our way. Welcome to the jungle. Like nearly every factor here, the songs and blood-soaked interludes alike are not without skill, but get kick-dropped into an inorganic whole uninterested in integrating them to sustained, logical or emotionally credible effect. During the interval, I was at a loss of theories. I didn’t know what to make of him or the film. All I could ask was: What’s the point? Why is Animal? Animal is an adrenaline experience which will have polarising views but you can't deny its entertaining quotient, breathtaking performances and storytelling.","WORST MOVIE EVER MADE FOR MANKIND! I appreciate you bobby deol This critic and audience rating difference can be explained by critic females (most movie critics are females) offended by some scenes from the movie. 

This epic motion picture with phenomenal cast, production and direction deserves a one time watch.
Drama and story are not the best. Quite long but wasn't as bad as expected. I didn't find the content so problematic for the first half. Not sure if that was done by the filmmakers for marketing. Had my mind blown by the film 'Animal'! Ranbir Kapoor is on another level, redefining the game with his acting prowess. He brings a perfect blend of swag, emotions, good looks and upholds the Kapoor legacy.
Sandeep Reddy Vanga, the Kabir Singh magician, does it again! Animal is a wild ride of unpredictability, killer action, outstanding screenplay and songs that will stay on loop. The storyline is wild, the action is killer, and those Punjabi beats and dialogues make it a total paisa vasool experience! 💯

Sure, there's been chatter about the film's themes, but isn't cinema supposed to spark discussions? Remember 'Kabir Singh'? The debates around it contributed to its massive success.😂 'Animal' is following suit, gearing up to cross the 800-900 crore mark. 

Art is subjective, and every piece has room for improvement. Each one has their own opinion. While the film might lack a conventional storyline and robust female characters, let's also celebrate the positives. As a cinephile, those 3 hours and 21 minutes were pure entertainment. Sometimes, that's all you need. Just leave your mind at home for this one and you will enjoy! 😄

And can we talk about the Deol brothers making a comeback? Sunny Deol's all-time blockbuster 'Gadar 2' and Bobby Deol doing his mad barbaric thing in 'Animal'- nostalgia hit me like a truck this year. They made our millennial days better with their unforgettable performances in great films! ‘Lord Bobby’ deserves all the appreciation he has been receiving! In fact it has been a great year for the entire Deol family, as veteran actor Dharamendra also gave a good performance in RRKPK!

Here's to cinema that makes us think, feel, and appreciate the craft!

PS: Remember, if film characters really inspired people in reality, most of us would be criminals, roaming around with guns, smoking, drinking all day, practicing domestic violence, etc. etc. Thankfully, it's just the magic of the movies. Stopped watching after the gun fight. It was too much and unrealistic. How in the world this type of a trashy movie was approved? All the female characters were objectified. Specifically saying Rashmika, who has so much potential, was interpreted as more like a mentally disabled vulgar subservient object. Who in the world would just elope with a guy who just says he's the Alpha and commented about your PELVIS. Made no SENSE to me. Too much unnecessary intimacy and useless dialogues. That scene where Ranbir complains about his underwear, I still wonder how that part  connected to the storyline. I don't know what happened afterwards because I could not tolerate this garbage. The director is a psychopath for sure who adores misogynism. I still cannot get my head over the fact that how these reputed actors and actresses agreed to even commit themselves for this trashy plot. A huge amount was put into their pockets, maybe that's why! No character development, no redemption, desensitization to its finest. Parents keep your children away from this garbage. Don't waste your time. And kindly let us rate with negatives; -1 will be the best rating if I could have given. Best Indian Movie Ever in 2023-2024! 10/10 Worst ever disgusting irritating Really if You unbiased Worst movie I have seen for a very long time. Gave up after 2 and an half hours of utter ridiculousness!!!!

Save yourselves wasting 3.5hrs of your life!!! Worst movie ever. No dialogues, no story, too much irrational scenes. Violations. Giving wrong motivations to society. What.the.hell.was.that?! 

I'm fine with gore but good grief! The dialogues, for one thing. Who the hell talks like that?! There were SO many unnecessary scenes, drawn out to eternity for no reason at all. I went in thinking perhaps it's highly stylized. No. It was just bad. 

In short, a terrible storyline to justify gore. Good and the best theater experiance I have watched thousands of movies in my life and this one would be very hard to beat when it comes to being an absolutely horrible, non-sensical and meaningless movie! Ranbir's ""acting"" is trashy and vaudevillian at best. Other characters are there just to fill up the screen and spray bullets at other characters who are also there to fill up the screen. Overall, a complete waste of 2.5 hours of my life. Possibly the most pointless movie with no entertainment element. Truth is that there's no place in this planet where you can relate this movie, it's Unreal. This movie is like video game. In reality there's a law and we all have to obey it.

Acting wise Ranbir is good, Rashmika below average, tripti - good, Bobby - good. Performance and body language of 'saurabh sachdeva' is really impressive. Direction of Reddy sir is fine but again this planet doesn't deserve this kind of cinema. Father- son relationship doesn't go like that, you can't kill hundreds of people to prove that bonding, In reality if you does you will be charged with different sections and will be prosecuted.

4 stars for music. Thanks. A very good bollywood film in a long time! Utterly ridiculous and disturbing story. Non sense and nonstop violence with no moral at the end . Extremely disappointed. Movie of the decade.

Everything is great about this movie.
Already watched it two times.
Will watch it again. Great fun time at the movies & I can't wait got the sequel Honestly hated how he cheated on his wife like it was nothing but if she did the same thing he would kill the guy ... Made me so angry"
